title,date,content,link
สถานีคิดเลขที่ 12 : ‘ยุติ’โดย‘ธรรม’อย่างไร,วันที่ 5 กุมภาพันธ์ 2566 - 09:33 น.,"สถานีคิดเลขที่ 12 : ‘ยุติ’โดย‘ธรรม’อย่างไร
กรณี อัน หยู ชิง นักท่องเที่ยวไต้หวัน กับกรณี ตะวัน-แบม น่าจะเป็นคนละเรื่อง
แต่จริงแล้วเป็นกรณีที่เกี่ยวข้องกันอย่างน่าพิจารณา
กรณี อัน หยู ชิง อย่างที่ทราบ เกี่ยวเนื่องกับ “บุหรี่ไฟฟ้า”
บุหรี่ไฟฟ้า ที่ยังหาข้อสรุปไม่ได้ว่า เมื่อเทียบกับบุหรี่ธรรมดา
อะไรอันตรายกว่ากัน
แต่บุหรี่ไฟฟ้า กลายเป็นสิ่งที่ผิดกฎหมาย “ฉกรรจ์” ไปแล้ว
และความฉกรรจ์นี้ นำไปสู่การแสวงหาประโยชน์ของคนในกระบวนการยุติธรรม อย่างที่เกิดขึ้นกับ อัน หยู ชิง
หรือแม้จะไม่มีการแสวงหาประโยชน์
แต่แค่ถูกดำเนินคดีไปตามเนื้อผ้า
บุหรี่ไฟฟ้าก็อาจทำให้เราเข้าคุกได้ง่ายๆ
เราไม่อาจเรียกร้องให้มีการใช้ดุลพินิจเพื่อเปรียบเทียบพิษภัยกับบุหรี่ปกติ หรืออาจเลยเถิดไปถึงกัญชาที่วันนี้ผ่อนปรนจนแทบจะเป็นสมุนไพรไปแล้ว
ดังนั้นหากเป็นผู้ต้องหาเรื่องบุหรี่ไฟฟ้า ทุกข์หนักแน่ๆ
เผลอๆ พลั้งพลาดนำบุหรี่ไฟฟ้าเข้ามาในประเทศ นอกจากอาจเจอโทษจำคุกไม่เกิน 10 ปีแล้ว
ยังอาจถูกเจ้าหน้าที่ในกระบวนการยุติธรรม ใช้ดุลพินิจชี้ว่านี่เป็นคดีที่มีโทษหนัก
เลยไม่ให้ประกันตัว ต้องถูกจำคุกระหว่างรอคำตัดสินกันอีกนาน
นี่คือสิ่งที่เรามีสิทธิเผชิญ และชวนให้ตั้งคำถาม
ตั้งคำถาม เช่นเดียวกับ คดีความมั่นคง โดยเฉพาะที่สืบเนื่อง กับมาตรา 112 และ 116
ซึ่งเป็นคดีที่มีโทษหนักมาก
และเปิดให้คนในกระบวนการยุติธรรมตั้งแต่ต้นถึงปลายน้ำใช้ดุลพินิจได้กว้างขวางด้วย
อย่างที่เราทราบกันดี คดีความมั่นคง ส่วนใหญ่เป็นคดีทางการเมือง ที่หลายกรณีเป็นเรื่องอุดมการณ์ ความคิด จุดยืน ที่แตกต่างกัน
ซึ่งแม้รัฐธรรมนูญเปิดช่องให้บุคคลมีสิทธิเสรีภาพที่จะแสดงความเห็นและจุดยืนนั้นได้
แต่ด้วยสภาพบ้านเมืองที่แตกเป็นหลายขั้ว
และด้วยสังคมที่มีพลวัตรตลอดเวลา เกิดคนรุ่นใหม่ แนวคิดใหม่ เทคโนโลยีใหม่ ทำให้มุมมองต่อสิ่งที่คนส่วนใหญ่เคยเห็น “ร่วมกัน” เปลี่ยนไป
เกิดการตั้งคำถาม เกิดการเรียกร้องให้ปฏิรูป หรืออาจจะสุดขั้วถึงขั้น “เปลี่ยน”
จึงนำไปสู่การเผชิญหน้าของฝ่ายที่ต้องการให้คงเอาไว้ตามเดิม กับฝ่ายที่ต้องการให้มีการถอดรื้อ
ซึ่งไม่อาจปฏิเสธว่า นี่มิใช่ ความขัดแย้ง
แต่เป็นความขัดแย้งที่ควรจะหาทางออก ประนีประนอม ตามระบอบประชาธิปไตย ที่ไม่มีฝ่ายใดได้หรือเสีย 100%
การต่อรองต้องดำเนินไปตลอดเวลา
ไม่อาจใช้วิธีการใด วิธีการหนึ่งอย่างแข็งตัว
เช่นคำพูดที่ได้ยินกันบ่อยๆ “ว่าไปตามกฎหมาย”
แม้ฟังดูดี แต่ก็สร้างปัญหาไปพร้อมๆ กัน
ฝ่ายที่กุมอำนาจ ที่มองฝ่ายที่เห็นต่างเป็น “ศัตรู” ต้องกำจัดไป
ทำให้การแสดงความเห็น การแสดงออกทางสัญลักษณ์ หรือการชุมนุม ถูกมองว่าเป็นการคุกคาม
ซึ่งก็มีผลทั้งโดยตรงและโดยอ้อม กดดันให้คนในกระบวนการยุติธรรมงัดกฎหมายตั้งแต่เบาสุดไปถึงหนักสุดอย่างมาตรา 112 และ 116 ขึ้นมาใช้กับฝ่ายเห็นต่างอย่างเต็มที่
ทั้งที่ในบางกรณี มีคำถามว่าเข้าข่ายผิด “ร้ายแรง” ขนาดนั่นเลยหรือ
ซึ่งเมื่อตั้งข้อหาฉกรรจ์ไปแล้ว ย่อมกระทบไปทั้งขบวน เช่นการประกันตัว การสั่งฟ้อง-ไม่ฟ้อง
ที่ทำให้ผู้ถูกกล่าวหาเห็นว่าไม่ได้รับความเป็นธรรม ถูกเลือกปฏิบัติ นำไปสู่การต่อสู้เพื่อทวงสิทธิพื้นฐานนั้น
กรณีอดข้าวของ “ตะวัน-แบม” ก็มาจากกรณีนี้
แน่นอนมันสะท้อนปัญหาของกระบวนการยุติธรรมที่จำต้องหาทางออกร่วมกัน
มิเช่นนั้น จะนำไปสู่ภาวะแตกหัก ที่ยากจะกู้คืนได้
และเฉพาะหน้านี้ หวังว่ากรณีเร่งด่วน “ตะวัน-แบม” จะหาทางออก “ร่วมกัน” ได้ก่อน
จากนั้นคง ต้องหาทาง “ยุติ” ปัญหาที่หมักหมม โดย “ธรรม” ต่อไป
สุวพงศ์ จั่นฝังเพ็ชร",https://www.matichon.co.th/columnists/news_3806731
‘ธนกร’ หนุน รทสช.ตั้ง ‘บิ๊กตู่’ นั่ง ปธ.ยุทธศาสตร์พรรค ชี้ผลงานชัดเจน จับต้องได้,วันที่ 5 กุมภาพันธ์ 2566 - 09:33 น.,"เมื่อวันที่ 5 กุมภาพันธ์ นายธนกร วังบุญคงชนะ รัฐมนตรีประจำสำนักนายกรัฐมนตรี และสมาชิกพรรครวมไทยสร้างชาติ กล่าวถึงกรณีที่พรรครวมไทยสร้างชาติตั้ง พล.อ.ประยุทธ์ จันทร์โอชา นายกฯ และรมว.กลาโหม เป็นประธานคณะกรรมการกำหนดแนวทางและยุทธศาสตร์พรรคการเมืองว่า วัตถุประสงค์ของการตั้งคณะกรรมการชุดดังกล่าว เพื่อพิจารณากำหนดแนวทางการทำงานและยุทธศาสตร์พรรค รวมถึงเสนอแนะ และให้ความเห็นต่อคณะกรรมการบริหารพรรค เกี่ยวกับการดำเนินกิจกรรมทางการเมืองของพรรค และเสนอแนะ ให้ความเห็นต่อหัวหน้าพรรค กรรมการบริหารพรรค คณะกรรมการต่างๆ ของพรรค และสมาชิกพรรค เกี่ยวกับการดำเนินกิจกรรมทางการเมืองของพรรคและสมาชิกพรรค ทั้งหมดก็เพื่อเตรียมพร้อมสำหรับการเลือกตั้งที่กำลังจะมาถึง ทั้งนี้ เชื่อว่าจะทำให้พรรคได้รับเสียงตอบรับจากประชาชนเพิ่มขึ้นเรื่อยๆ อย่างแน่นอน เพราะ พล.อ.ประยุทธ์บริหารประเทศตลอดระยะเวลาที่ผ่านมาโดยมีผลงานชัดเจน จับต้องได้ เป็นรูปธรรม ขณะที่ระบบการจัดการภายในพรรคที่ดี ยิ่งส่งเสริมให้พรรคได้รับความไว้วางใจจากประชาชนมากยิ่งขึ้นด้วย
“ทั้งท่านนายกฯ และนายพีระพันธุ์ สาลีรัฐวิภาค หัวหน้าพรรค มีสิ่งหนึ่งที่เหมือนกันอย่างชัดเจนคือ เป็นคนมือสะอาด จริงจังกับการแก้ปัญหาให้กับประชาชน โดยเฉพาะเรื่องความซื่อสัตย์สุจริตเป็นที่ประจักษ์ในสายตาประชาชน ทั้งนี้ ทราบว่าขณะนี้ท่านนายกฯ เริ่มคิดนโยบายเพื่อต่อยอดความสำเร็จในนโยบายต่างๆ ของรัฐบาลไว้บ้างแล้ว ไม่ว่าจะเป็นโครงการบัตรสวัสดิการแห่งรัฐ หรือบัตรลุงตู่ โครงการคนละครึ่ง หรือโครงการเราเที่ยวด้วยกัน ขณะที่ว่าที่ผู้สมัคร ส.ส.ของพรรคนั้น กรรมการบริหารพรรคได้คัดสรรผู้สมัครที่มีคุณวุฒิเพียบพร้อมไว้เกือบครบแล้ว และยังมีอดีต ส.ส.คุณภาพที่ยังคงทยอยเปิดตัวมาร่วมงานกับพรรคอย่างต่อเนื่องอีกด้วย ที่สำคัญ เมื่อปี 62 ท่านนายกฯ เป็นแค่แคนดิเดตนายกฯ ยังชนะมาแล้ว ดังนั้น ปีนี้หากท่านนายกฯ ลุยหาเสียง และขึ้นเวทีปราศรัยด้วยตัวเอง เชื่อว่าพรรคจะได้รับการตอบรับจากประชาชนมากกว่าเดิมแน่นอน” นายธนกรกล่าว",https://www.matichon.co.th/politics/news_3807385
ธำรงศักดิ์ ย้อนวิจัยเชิงลึก ปม ‘กปปส.’ ชี้คนกรุงเทพฯ 61.83 ไม่เห็นด้วย ฝ่ายหนุน-โนคอมเมนต์สูสี,วันที่ 5 กุมภาพันธ์ 2566 - 09:26 น.,"เมื่อวันที่ 5 กุมภาพันธ์ ผู้สื่อข่าวรายงานว่า รองศาสตราจารย์ ดร.ธำรงศักดิ์ เพชรเลิศอนันต์ คณะรัฐศาสตร์ ม.รังสิต เปิดเผยผลวิจัยส่วนบุคคลโดยเก็บข้อมูลจากคนกรุงเทพฯ (อายุ 18 ปีขึ้นไป มี 4.48 ล้านคน ประชากรกรุงเทพฯ 5.52 ล้านคน) เก็บแบบสอบถามจำนวน 1,200 คน
ข้อคำถามว่า “ท่านเห็นด้วยหรือไม่ กับการชัตดาวน์กรุงเทพฯ ของ กปปส. เมื่อ พฤศจิกายน พ.ศ.2556-พฤษภาคม พ.ศ.2557”
​ผลการวิจัย สรุปดังนี้
​1.คนกรุงเทพฯ ไม่เห็นด้วยกับการชัตดาวน์กรุงเทพฯ ของ กปปส. จำนวน 742 คน คิดเป็นร้อยละ 61.83 คนกรุงเทพฯ เห็นด้วยกับการชัตดาวน์กรุงเทพฯ ของ กปปส. 239 คน คิดเป็นร้อยละ 19.92 ส่วนไม่แสดงความเห็น 219 คน คิดเป็นร้อยละ 18.25
​2. คนกรุงเทพฯ ที่ไม่เห็นด้วยกับการชัตดาวน์กรุงเทพฯ ของ กปปส. คือคนที่จะไม่เห็นด้วยกับการรัฐประหาร คสช. 22 พฤษภาคม 2557
​3. จากการเก็บข้อมูลเชิงลึก คนกรุงเทพฯ ที่ไม่เห็นด้วยกับการชัตดาวน์กรุงเทพฯ ของ กปปส. นั้นมีคำอธิบายว่า เป็นการชุมนุมทางการเมืองเพื่อสร้างสถานการณ์ให้ทหารทำรัฐประหาร เป็นการชุมนุมทางการเมืองที่ได้รับความคุ้มครองจากรัฐทหารศักดินา เป็นการชุมนุมทางการเมืองที่วางแผนทำลายประชาธิปไตย เป็นการชุมนุมทางการเมืองที่ใช้ความรุนแรง เป็นการชุมนุมทางการเมืองที่ทำลายเศรษฐกิจของชาติ เป็นการชุมนุมทางการเมืองเพื่อรักษาระบอบเก่า
​คนกรุงเทพฯ ที่เห็นด้วยกับการชัตดาวน์กรุงเทพฯ ของ กปปส. นั้นมีคำอธิบายว่า เป็นการกู้ชาติ เป็นการกำจัดระบอบทักษิณ เป็นการกำจัดตระกูลกินเมือง เป็นการต่อต้านประชาธิปไตยของทุนสามานย์ เป็นการต่อต้านเผด็จการรัฐสภา เป็นการชุมนุมเพื่อทำลายพวกธนกิจการเมือง เป็นการสร้างพลังประชาชนที่แข็งแกร่ง เป็นการต่อต้านนิรโทษกรรมสุดซอย เป็นสิทธิเสรีภาพขั้นพื้นฐานของประชาชน เป็นการชุมนุมทางการเมืองเพื่อการสร้างระบอบการเมืองใหม่ที่มีความเป็นธรรมทางเศรษฐกิจและสังคม เป็นการชุมนุมทางการเมืองเพื่อให้มีการปฏิรูปก่อนเลือกตั้ง
​ข้อมูลพื้นฐาน
​งานวิจัยทัศนคติของคนกรุงเทพต่อสังคมการเมืองไทยนี้ เก็บข้อมูลระหว่างวันที่ 3-18 ธันวาคม 2565 รวม 1,200 คน โดยเก็บแบบสอบถามจาก กลุ่มเขตกรุงเทพเหนือ (เขตลาดพร้าว เขตหลักสี่ เขตจตุจักร เขตบางซื่อ เขตสายไหม เขตบางเขน และเขตดอนเมือง) กลุ่มเขตกรุงเทพกลาง (เขตสัมพันธวงศ์ เขตดุสิต เขตพระนคร เขตป้อมปราบศัตรูพ่าย เขตพญาไท เขตราชเทวี เขตดินแดง เขตวังทองหลาง และเขตห้วยขวาง) กลุ่มเขตกรุงธนใต้ (เขตภาษีเจริญ เขตบางแค เขตหนองแขม เขตราษฎร์บูรณะ เขตทุ่งครุ เขตบางขุนเทียน และเขตบางบอน)
​เพศของผู้ตอบแบบสอบถาม : หญิง 483 คน (40.25%) ชาย 546 คน (45.50%) เพศหลากหลาย 171 คน (14.25%)
​อายุของผู้ตอบแบบสอบถาม: Gen Z (18-25 ปี) 377 คน (31.42%), Gen Y (26-42 ปี) 549 คน (45.75%), Gen X (43-57 ปี) 167 คน (13.93%), Gen Baby boomer (58 ปีขึ้นไป) 107 คน (8.92%)
​อาชีพหลักของผู้ตอบแบบสอบถาม: นักเรียนนักศึกษา 193 คน (16.08%) พนักงานเอกชน 461 คน (38.42%) รับจ้างทั่วไป/ผู้ใช้แรงงาน 143 คน (11.92%) เจ้าของธุรกิจ/อาชีพอิสระ 186 คน (15.50%) ข้าราชการ/พนักงานของรัฐ/รัฐวิสาหกิจ 115 คน (9.58%) พ่อบ้าน/แม่บ้าน/เกษียณอายุ/ว่างงาน 93 คน (7.75%) อื่นๆ 9 คน (0.75%)
​รายได้ต่อเดือนของผู้ตอบแบบสอบถาม: ไม่มีรายได้ 109 คน (9.08%) รายได้ไม่เกิน 10,000 บาท 128 คน (10.67%) รายได้ 10,001-20,000 บาท 262 คน (21.83%) รายได้ 20,001-30,000 บาท 403 คน (33.58%) รายได้ 30,001- 40,000 บาท 198 คน (16.51%) รายได้ 40,001 บาทขึ้นไป 100 คน (8.33%)
​ทีมผู้ช่วยวิจัย : นายสหรัฐ เวียงอินทร์ นายชนวีย์ กฤตเมธาวี นายศุภกาญจน์ เป็งเมืองมูล นักศึกษาคณะรัฐศาสตร์ ม.รังสิต",https://www.matichon.co.th/politics/news_3807376
