title,date,content,link
อังคณา ดึงสติ เพื่อนส.ว.สีน้ำเงิน ฟ้องปิดปากรมว.ยุติธรรม แนะควรใช้โอกาสนี้พิสูจน์ตัวเอง,วันที่ 22 กุมภาพันธ์ 2568 - 16:11 น.,"อังคณา ดึงสติ เพื่อนส.ว.สีน้ำเงิน ฟ้องปิดปากรมว.ยุติธรรม แนะควรใช้โอกาสนี้พิสูจน์ตัวเอง
เมื่อวันที่ 22 กุมภาพันธ์ 2568 อังคณา นีละไพจิตร สมาชิกวุฒิสภา (ส.ว.) กรณี นายมงคล สุระสัจจะ ประธานวุฒิสภา นำทีม ส.ว.สายสีน้ำเงิน ตั้งโต๊ะแถลงข่าวตอบโต้กรมสอบสวนคดีพิเศษ (ดีเอสไอ) จ่อนำคดีโพยฮั้วเลือก ส.ว.เป็นคดีพิเศษว่า กรณีข่าว ส.ว. จะล่ารายชื่อถอดถอนรัฐมนตรีว่าการกระทรวงยุติธรรม จะเปิดอภิปรายในสภา และจะฟ้องร้องดำเนินคดี รัฐมนตรีว่าการกระทรวงยุติธรรมนั้น ส่วนตัวไม่เห็นด้วยอย่างยิ่ง เพราะการโต้กลับลักษณะเช่นนี้อาจถูกมองว่าเป็นการแก้แค้น หรือตอบโต้ (reprisal) เพื่อไม่ให้มีการตรวจสอบ อีกทั้งที่ผ่านมาสังคมได้มีการตั้งคำถามถึงการเลือก และการปฏิบัติหน้าที่ของ ส.ว. มาโดยตลอด การตรวจสอบของกรมสอบสวนคดีพิเศษ จึงอาจเป็นหนทางหนึ่งที่สมาชิกวุฒิสภาทุกคน จะได้พิสูจน์ตัวเองเพื่อให้สังคมได้ทราบข้อเท็จจริง ซึ่งหากไม่เป็นความจริงตามที่ถูกกล่าวหา ผู้กล่าวหาก็จำเป็นต้องชดใช้เยียวยาความเสียหาย และคืนศักดิ์ศรีให้ ส.ว. ทุกท่านที่ถูกกล่าวหา
ส่วนเรื่องที่ ส.ว. ต้องการฟ้องร้องดำเนินคดีผู้กล่าวหานั้น ส.ว. ที่จะฟ้องคดีจำเป็นต้องพิจารณาด้วยความรอบคอบและระมัดระวัง เนื่องจากการขู่จะดำเนินคดีกับผู้กล่าวหา อาจเข้าข่ายการเป็นการฟ้องเพื่อปิดปาก หรือการดำเนินคดีเชิงยุทธศาสตร์เพื่อปิดกั้นการมีส่วนร่วมสาธารณะ (SLAPP) เนื่องจากกรณีนี้สังคมให้ความสนใจอย่างมาก และ ส.ว. เองก็ถูกวิพากษ์วิจารณ์ในประเด็นนี้มาโดยตลอด ส่วนตัวมีความเห็นว่า สิ่งที่ ส.ว. ควรทำ คือ การชี้แจงข้อเท็จจริง พร้อมกับยอมรับการตรวจสอบจากทุกฝ่ายเพื่อแสดงความบริสุทธิ์
ส่วนคำถามที่ว่าทำไมต้องเป็นกรมสอบสวนคดีพิเศษ ก็เพราะ พรบ. การสอบสวนคดีพิเศษ พ.ศ. 2547 ให้อำนาจ DSI ในการทำคดีที่ซับซ้อน คดีที่เกี่ยวข้องกับผู้มีอิทธิพล หรือคดีที่มีผู้เกี่ยวข้องจำนวนมาก นอกจากนั้น DSI ยังมีอำนาจในการให้ความคุ้มครองพยาน เพื่อให้พยานรู้สึกปลอดภัยและสามารถให้การเป็นพยานในชั้นศาลได้ … เรื่องนี้ ส.ว. ที่จะลงชื่อฟ้องคดีกับผู้กล่าวหา จึงต้องชั่งน้ำหนักระหว่างการป้องกันตนเอง กับประโยชน์ที่สาธารณะจะพึงได้รับ เนื่องจากสิทธิประโยชน์ต่าง ๆ ของสมาชิกวุฒิสภาทุกบาททุกสตางค์ล้วนมาจากภาษีของประชาชน ประชาชนจึงต้องสามารถตรวจสอบการทำหน้าที่ของ ส.ว. ผ่านกลไกต่างๆ ได้ อีกทั้งเรื่องนี้ก็ได้มีผู้ไปร้องเรียนต่อกรมสอบสวนคดีพิเศษ และ กกต. แล้ว จึงควรทำความจริงให้ปรากฏ การป้องป้องศักดิ์ศรีของตนเอง กับการปิดกั้นประโยชน์สาธารณะ จึงเป็นคนละเรื่อง และในฐานะที่ ส.ว. ได้ชื่อว่า ส.ว. ของประชาชน จึงควรถ่อมตน ใจกว้าง และยอมรับการตรวจสอบ เพื่อทำให้เกิดความโปร่งใส และเป็นธรรมสำหรับทุกฝ่าย และอย่างที่ได้พูดไปแล้ว คือ หากสุดท้ายข้อกล่าวหาดังกล่าวพิสูจน์แล้วไม่เป็นความจริง ทุกฝ่ายที่เกี่ยวข้องก็จะต้องชดใช้เยียวยา และคืนศักดิ์ศรีให้กับวุฒิสมาชิกที่ถูกกล่าวหาทุกคน
เรื่องนี้ถือเป็นหลักการพื้นฐานของหลักนิติธรรมที่ทุกคนต้องเคารพ",https://www.matichon.co.th/politics/news_5061421
ศิริกัญญา ยัน ซักฟอก 5 วันเหมาะสุด จ่อเปิดข้อมูลใหม่ สะท้อนรอยร้าวรบ. จับตาเสียงลงมติ,วันที่ 22 กุมภาพันธ์ 2568 - 15:34 น.,"“ศิริกัญญา” ชี้ เปิดเวทีซักฟอกกลางเดือน มี.ค. เหมาะสมที่สุด ยืนกรานใช้ 5 วัน แย้ม มีเนื้อหาที่ไม่เคยเผยมาก่อน สะท้อนรอยร้าวรัฐบาล
เมื่อวันที่ 22 กุมภาพันธ์ นางสาวศิริกัญญา ตันสกุล ส.ส.บัญชีรายชื่อ และรองหัวหน้าพรรคประชาชน (ปชน.) ให้สัมภาษณ์ถึงการยื่นญัตติอภิปรายไม่ไว้วางใจรัฐบาล ว่า จะยื่นในวันที่ 27 กุมภาพันธ์นี้ ส่วนกรอบเวลาการอภิปราย ยังยืนยันว่าควรเป็น 5 วัน ซึ่งคิดว่ากลางเดือนมีนาคม เป็นช่วงที่เหมาะสมที่สุด ไม่ควรเกินสัปดาห์ที่ 3 ของเดือน
ผู้สื่อข่าวถามว่า กังวลว่ารัฐบาลจะขอเลื่อนเวลาออกไปเพื่อเตรียมข้อมูลหรือไม่ นางสาวศิริกัญญา กล่าวว่า ไม่กังวล เราให้เขามีโอกาสแก้ตัวเต็มที่ และคงลากยาวไปไม่ได้เท่าไหร่ เพราะสมัยประชุมนี้จะหมดในวันที่ 10 เมษายน หากรัฐบาลให้เกียรติสภา ก็ควรจะให้คำตอบภายในเร็ววัน
เมื่อถามถึงประเด็นที่จะใช้ในการอภิปราย นางสาวศิริกัญญา กล่าวว่า เป็นเรื่องที่ปรากฏอยู่ และประชาชนให้ความสนใจ ซึ่งจะมีข้อมูลเชิงลึกเพิ่มเติม รวมถึงมีเรื่องที่ไม่เคยเปิดเผยที่ไหนมาก่อน
ถามว่า คิดว่าเสียงของฝั่งรัฐบาลจะมีพอในการโหวตไว้วางใจหรือไม่ น.ส.ศิริกัญญา กล่าวว่า ช่วงนี้ก็มีข่าวที่พรรคร่วมรัฐบาล ทำหน้าที่เป็นฝ่ายค้าน ทั้งเรื่องที่ดินและการฮั้วเลือก ส.ว. มีการยื่นญัตติอภิปรายรัฐมนตรีของพรรคตัวเองด้วยซ้ำ ซึ่งปรากฏรอยร้าวชัดเจน ดังนั้น การอภิปรายไม่ไว้วางใจของเราครั้งนี้ จะแสดงถึงรอยร้าวดังกล่าว และรอดูมติว่า จะยังสามารถกุมอำนาจนํารัฐบาลได้อยู่หรือไม่",https://www.matichon.co.th/politics/news_5061400
ส.ส.เพื่อไทย ปรามส.ว.สีน้ำเงิน ต้องพร้อมรับการตรวจสอบ แนะถ้าไม่ได้ทำผิด ไม่ต้องกลัว,วันที่ 22 กุมภาพันธ์ 2568 - 15:25 น.,"“อนุสรณ์” ปราม ส.ว.สีน้ำเงิน ความกลัวทำให้เสื่อม แนะเคารพการตรวจสอบ อย่าทำตัวเหมือนใครแตะไม่ได้
เมื่อวันที่ 22 กุมภาพันธ์ 2568 นายอนุสรณ์ เอี่ยมสะอาด ส.ส.บัญชีรายชื่อ พรรคเพื่อไทย (พท.) กล่าวกรณี นายมงคล สุระสัจจะ ประธานวุฒิสภา นำทีม ส.ว.สายสีน้ำเงิน ตั้งโต๊ะแถลงข่าวตอบโต้กรมสอบสวนคดีพิเศษ (ดีเอสไอ) จ่อนำคดีโพยฮั้วเลือก ส.ว.เป็นคดีพิเศษว่า ความกลัวทำให้เสื่อม ถ้าไม่ได้ทำอะไรผิด ก็ไม่มีอะไรต้องกลัว ต้องทำความเข้าใจก่อนว่า การที่มีคนสมัครเข้าเป็น ส.ว.เกือบ 50,000 คน ผ่านระบบการเลือกกันเอง เพื่อให้ได้ ส.ว.จำนวนทั้งสิ้น 200 คนนั้น มีคนเข้าร่วม และเห็นกระบวนการได้มาซึ่ง ส.ว.จำนวนมาก การร้องทุกข์กล่าวโทษว่าการเลือก ส.ว.ในบางส่วนอาจมีการ ทำโพยฮั้วกันหรือไม่ ถือเป็นสิทธิ มีการตั้งข้อสังเกตว่า ขบวนการจัดตั้งการฮั้ว ส.ว.อาจมีจำนวนผู้สมัครที่อยู่ในขบวนการประมาณ 1,200 คน มีการพักที่เดียวกัน แจกเสื้อสีเดียวกัน อำนวยความสะดวกในการจัดหารถตู้โดยสารส่งผู้สมัคร ทำกันเป็นขบวนการ ส่วนจะตรวจสอบ ส.ว.หรือตัวสำรองคนใดก็ต้องให้ผู้รับผิดชอบได้ทำงานอย่างตรงไปตรงมา รวมถึงหากมีการฮั้วเลือกตั้ง ส.ว.แล้ว จะขยายผลไปยังฐานความผิดอื่นด้วยหรือไม่ ก็ต้องปล่อยให้เป็นหน้าที่ของผู้มีหน้าที่รับผิดชอบในการทำคดี
นายอนุสรณ์กล่าวต่อว่า เรื่องนี้จึงไม่ใช่เกมการเมืองบั่นทอนวุฒิสภา เพราะมี ส.ว.ที่ไม่ได้เดือดร้อนจากการตรวจสอบครั้งนี้อยู่จำนวนหนึ่ง ในทางกลับกันถ้าผลการตรวจสอบไม่พบการกระทำความผิด จะ ส.ว.สายสีน้ำเงินหรือสีไหน ก็เดินหน้าปฏิบัติหน้าที่ต่อไป อะไรที่คลุมเครือที่สังคมกังขา ก็ทำให้โปร่งใสตรวจสอบได้ ไม่มีอะไรต้องกลัว
”พวกท่านมาเป็น ส.ว.แล้ว ต้องพร้อมรับการตรวจสอบ ต้องพร้อมพิสูจน์ตัวเอง ไม่ใช่ใครแตะอะไรไม่ได้เลย ต้องเข้าใจและเคารพในสิทธิของผู้ร้อง ให้เกียรติและเชื่อมั่นในกระบวนการตรวจสอบ ถ้าไม่ได้ทำอะไรผิด ไม่ต้องกลัว” นายอนุสรณ์กล่าว",https://www.matichon.co.th/politics/news_5061402
ส.ว.งงเจอข้อหาหนัก อั้งยี่ซ่องโจร โต้โพยฮั้ว ยันไม่เคยรู้จักกันมาก่อน-ไม่มีนัดเจอที่โรงแรม,วันที่ 22 กุมภาพันธ์ 2568 - 15:02 น.,"“พิสิษฐ์” เผยรอหารือวิปวุฒิ 26ก.พ.โต้กลับดีเอสไอ ยันสว.ไม่เคยรู้จักกันมาก่อน งงหนัก เข้าข่ายอ้างซ่องโจรได้อย่างไร
เมื่อวันที่ 22 กุมภาพันธ์ 2568 นายพิสิษฐ์ อภิวัฒนาพงศ์ สมาชิกวุฒิสภา (ส.ว.) กล่าวถึงความคืบหน้าการดำเนินการตอบโต้กรมสอบสวนคดีพิเศษ (ดีเอสไอ) ที่จะพิจารณารับคดีฮั้วเลือกส.ว. ปี 2567 เป็นคดีพิเศษ ว่า ในการประชุมคณะกรรมการกิจการวุฒิสภา (วิปวุฒิสภา) วันที่ 26 กุมภาพันธ์นี้ จะหารือถึงการดำเนินการเอาผิดฝ่ายที่เกี่ยวข้องกล่าวหาส.ว.เรื่องการฮั้วเลือกส.ว.ว่า จะดำเนินการอย่างไรบ้าง แต่ก็ไม่แน่ใจว่าการประชุมวุฒิสภาในวันที่ 23 กุมภาพันธ์นี้ จะมีส.ว.คนใดหยิบประเด็นดังกล่าวมาหารือในที่ประชุมหรือไม่
“ยืนยันว่า กระบวนการเลือกส.ว.ทำถูกต้องตามกฎหมาย เป็นไปตามขั้นตอนประชาธิปไตย ไม่เข้าใจว่าผิดพระราชบัญญัติ (พ.ร.บ.) ประกอบรัฐธรรมนูญว่าด้วยการได้มาซึ่งส.ว.ได้อย่างไร ยิ่งข้อหาอั้งยี่ซ่องโจร เป็นภัยต่อความมั่นคงในราชอาณาจักรตามที่ดีเอสไอกล่าวหา ยิ่งงงหนัก จะไปเข้าข่ายได้อย่าง ส.ว.ทุกคนไม่เคยรู้จักกันมาก่อน ไม่เคยไปพบกันที่โรงแรมตามที่มีการกล่าวหา เพิ่งมารู้จักกันในที่ประชุม หลังเป็นส.ว.แล้ว ดังนั้นการจะเข้าข่ายอั้งยี่ซ่องโจรจะต้องรู้จักกันมาก่อน” นายพิสิษฐ์ กล่าว
นายพิสิษฐ์ กล่าวต่อว่า ส่วนการมองว่าเป็นเกมการเมืองเพื่อตอบโต้ส.ว. ที่ยื้อการแก้รัฐธรรมนูญนั้น ก็มีความเป็นไปได้ หรือจะมองเป็นเหตุประจวบเหมาะก็ได้ ซึ่งกรณีการร้องเรียนฮั้วเลือกส.ว. ร้องมาตั้งแต่ปลายปี2567 แต่พอมีข่าวเรื่องแก้รัฐธรรมนูญก็เลยมีการประโคมข่าวจับแพะชนแกะกันไป",https://www.matichon.co.th/politics/news_5061359
จบภารกิจ ส่งกลับ แก๊งคอลเซ็นเตอร์ชาวจีน เที่ยวบินสุดท้ายแล้ว รวม 3 วัน 621 ราย,วันที่ 22 กุมภาพันธ์ 2568 - 14:54 น.,"จบภารกิจ ส่งกลับ แก๊งคอลเซ็นเตอร์จีน เที่ยวบินสุดท้ายแล้ว รวม 3 วัน 621 ราย
เมื่อวันที่ 22 กุมภาพันธ์ ผู้สื่อข่าวรายงานว่า หน่วยเฉพาะกิจราชมนู กองกำลังนเรศวร (ฉก.ราชมนู กกล.นเรศวร) แจ้วส่งกลับบุคคลสัญชาติจีน จากกระบวนการค้ามนุษย์ในประเทศหนึ่งมา โดยในวันนี้เป็นการส่งกลับเป็นวันที่ 3 เริ่มตั้งแต่เวลา 09.50 น. – 10.10 น. รถบัสเที่ยวที่ 1 จำนวน 2 คัน รับบุคคลสัญชาติจีน จำนวน 50 คน จากจุดผ่านแดนถาวรสะพานมิตรภาพไทย-เมียนมา แห่งที่ 2 บ.วังตะเคียน ม.7 ต.ท่าสายลวด อ.แม่สอด จ.ตาก เดินทางมาถึงท่าอากาศยานนานาชาติแม่สอด ต.ท่าสายลวด อ.แม่สอด จ.ตาก บุคคลสัญชาติจีน เข้าขบวนการตามกฎหมายตรวจคนเข้าเมืองของไทย
และเวลา 10.42 น. เครื่องบินเที่ยวที่ 1 สายการบิน China Southerm Airlnes เดินทางมาถึงท่าอาศยานนานาชาติแม่สอด ก่อนนำตัวทยอยขึ้นเครื่อง จากนั้นเวลา 11.15 น. เครื่องบินเที่ยวที่ 1 Take off จากท่าอาศยานนานาชาติแม่สอด เดินทางกลับปลายทางประเทศจีน
โดยระหว่างนั้นในเวลา 10.40 น.- 11.05 น. รถบัสเที่ยวที่ 2 จำนวน 2 คัน รับบุคคลสัญชาติจีน จำนวน 50 คน จากจุดผ่านแดนถาวรสะพานมิตรภาพไทย-เมียนมา แห่งที่ 2 บ.วังตะเคียน ม.7 ต.ท่าสายลวด อ.แม่สอด จ.ตาก เดินทางมาถึงท่าอากาศยานนานาชาติแม่สอด ต.ท่าสายลวด อ.แม่สอด จ.ตาก
จากนั้นเวลา 11.57 น. เครื่องบินเที่ยวที่ 2 สายการบิน China Southerm Airlnes เดินทางมาถึงท่าอาศยานนานาชาติแม่สอด และได้ นำกลุ่มบุคคลสัญชาติจีนทยอยเดินทางขึ้นเครื่อง และในเวลา 12.25 น. เครื่องบินเที่ยวที่ 2 Take off จากท่าอาศยานนานาชาติแม่สอด เดินทางกลับประเทศจีน
สำหรับเที่ยวสุดท้ายของวันนี้ ขึ้นจากท่าอากาศยานนานาชาติแม่สอดในเวลา 13.24 น. ร่วม บุคคลสัญชาติจีนที่เดินทางกลับในวันนี้ 121 คน ในวันที่ 20 กุมภาพันธ์ เดินทางกลับ 4 เที่ยวบิน รวม 200 คน และ วันที่ 21 กุมภาพันธ์ เดินทางกลับ 6 เที่ยวบิน รวม 300 คน รวมยอดทั้งสามวัน ที่ส่งกลับบุคคลสัญชาติจีน จำนวนทั้งสิ้น 621 คน",https://www.matichon.co.th/politics/news_5061369
