title,date,content,link
เด็จพี่ เย้ย ส.ว.กินปูนร้อนท้อง บอกทองแท้ไม่ต้องกลัวไฟ แนะเอาเวลาไปหาหลักฐานสู้คดีฮั้ว,วันที่ 22 กุมภาพันธ์ 2568 - 14:37 น.,"“เด็จพี่” ติง ส.ว.เปิดวอร์ รมต.คุมดีเอสไอเหมือนกินปูนร้อนท้อง ชี้คนดีตกน้ำไม่ไหล ต้องกล้าให้ตรวจสอบ เชื่อสง่างามกว่า
เมื่อวันที่ 22 กุมภาพันธ์ 2568 นายพร้อมพงศ์ นพฤทธิ์ อดีตโฆษกพรรคเพื่อไทย กล่าวกรณีที่กลุ่ม ส.ว.ประกาศสงครามเตรียมยื่นถอดถอนรัฐมนตรี และจะยื่นอภิปราย พร้อมจะเชิญรัฐมนตรีเข้าชี้แจงในกรรมาธิการว่า มองว่า ส.ว.ซึ่งเป็นฝ่ายนิติบัญญัติมีวุฒิภาวะ เมื่อถูกกล่าวหา มีผู้ร้องต่อหน่วยงาน ไม่ว่าจะเป็น กกต.หรือดีเอสไอ ก็ควรปล่อยให้กระบวนการสอบสวนดำเนินการไปตามกฎหมาย เพื่อพิสูจน์ว่าตนเองเป็นผู้บริสุทธิ์ มีพยานหลักฐานอะไรแก้ต่างก็ควรหามาต่อสู้ ชี้แจงแก้ข้อกล่าวหา กลุ่ม ส.ว.ที่ถูกกล่าวหา ถ้าไม่ผิดก็เป็นการพิสูจน์ตัวเอง ถือเป็นเรื่องดีซะอีก ดีกว่าออกมาตอบโต้ในลักษณะประกาศสงคราม จะยื่นถอดถอนรัฐมนตรีที่กำกับดูแลดีเอสไอ จะยื่นอภิปราย จะแจ้งความ แล้วยังเชิญรัฐมนตรีเข้าชี้แจงในกรรมาธิการ
“ทำอย่างนี้ประชาชนจะเข้าใจกันยังไง กินปูนร้อนท้องหรือเปล่า ร้อนตัวหรือไม่ กลุ่ม ส.ว.ที่ถูกร้องเรียน ดีเอสไอก็ยังไม่ได้เอ่ยชื่อว่าเป็นใคร กลุ่มใด ท่านเล่นออกมาตั้งโต๊ะแถลงข่าว พร้อมสวนกลับหน่วยงานตรวจสอบ คนก็รู้กันหมดว่าใครเป็นใคร แล้วยังสะท้อนให้เห็นถึงวุฒิภาวะคนกลั่นกรองกฎหมาย ออกกฎหมาย คนที่จะเลือกองค์กรอิสระ ควรต้องทำงานเป็นอิสระจริงๆ ต้องเคารพกฎหมายบ้านเมือง เป็นตัวอย่างที่ดี เป็นผู้หลักผู้ใหญ่ ทำหน้าที่ให้เป็นไปตามหลักนิติรัฐนิติธรรม“ นายพร้อมพงศ์กล่าว
นายพร้อมพงศ์กล่าวอีกว่า ตนอยากเรียกร้องให้กลุ่ม ส.ว.ที่ออกมาแถลงข่าวตอบโต้เอาคืน ตั้งสติครับ ตั้งสติ กลับไปเตรียมหลักฐานชี้แจงเพื่อพิสูจน์ตัวเองน่าจะดีกว่า ปล่อยให้หน่วยงานต่างๆ ที่มีผู้ไปร้องเรียน ตรวจสอบทำหน้าที่โดยอิสระน่าจะดีกว่า คงจะดูสง่างามมากกว่า ทองแท้ไม่กลัวไฟ คนดีตกน้ำไม่ไหล ตกไฟไม่ไหม้ ถ้าท่านกล้าแถลงข่าวกับสื่อมวลชน เมื่อพี่น้องประชาชนรับทราบ ท่านก็ต้องไม่กลัวการตรวจสอบพิสูจน์ความบริสุทธิ์ ตนขอตั้งคำถามไปยังกลุ่ม ส.ว.เหล่านี้ว่า สิ่งที่ท่านกำลังจะทำเป็นการกระทำที่เป็นการขัดกันแห่งผลประโยชน์หรือไม่ เป็นการสกัดกั้นกระบวนการยุติธรรมทางอาญาหรือเปล่า ดูเหมือนน่าจะเป็นการข่มขู่หน่วยงาน และข้าราชการที่ปฏิบัติหน้าที่ ตนขอให้กำลังใจผู้ที่ปฏิบัติหน้าที่ในการตรวจสอบเรื่องฮั้ว ส.ว.ในครั้งนี้ และขอให้พี่น้องประชาชนร่วมให้กำลังใจด้วย ส.ว.กลุ่มนี้ก็ไม่ควรกลัวการตรวจสอบ เดี๋ยวจะเข้าลักษณะว่าแต่เขาอิเหนาเป็นเอง เรื่องนี้ประชาชนจับตาดูอยู่",https://www.matichon.co.th/politics/news_5061329
โรม ยันบิ๊กรบ. เจอหลอกลวงครั้งใหญ่ ระบบไบโอเมตริกซ์ ใช้ไม่ได้จริง ฟ้องนายกฯ ตร.น้ำดีถูกกลั่นแกล้ง,วันที่ 22 กุมภาพันธ์ 2568 - 14:06 น.,"โรม ยันบิ๊กรบ. เจอหลอกลวงครั้งใหญ่ ระบบไบโอเมตริกซ์ ใช้ไม่ได้จริง ฟ้องนายกฯ ตร.น้ำดีถูกกลั่นแกล้ง
เมื่อวันที่ 22 กุมภาพันธ์ 2568 นายรังสิมันต์ โรม ส.ส.บัญชีรายชื่อ รองหัวหน้าพรรคประชาชน ในฐานะประธานคณะกรรมการธิการ (กมธ.) ความมั่นคงแห่งรัฐ กิจการชายแดนไทย ยุทธศาสตร์ชาติ และการปฏิรูปประเทศ ได้โพสต์ผ่านเฟซบุ๊กถึงการเก็บข้อมูลคนผ่านเข้า-ออกประเทศผ่านระบบไบโอเมตริกซ์ โดยระบุว่า
เรื่อง Biometrics หรือการเก็บอัตลักษณ์น่าจะเป็นการหลอกลวงครั้งใหญ่ที่ปกปิดโดย ตม. และสำนักงานตำรวจแห่งชาติ ผมเห็นคนในรัฐบาลหลายคนออกมายืนยันว่า ได้มีการเก็บข้อมูลอัตลักษณ์กับกลุ่มคนจีนที่ส่งตัวกลับไปจีนจากแม่สอด ขอย้ำอีกครั้งว่า ระบบไบโอเมตริกซ์ของเราใช้ไม่ได้จริง
อธิบายแบบนี้
ท่านมีการถ่ายรูปจริง มีการบันทึกลายนิ้วมือจริง แต่ระบบ Biometrics หรือการเก็บข้อมูลอัตลักษณ์ไม่ใช่แค่ถ่ายรูปและพิมพ์ลายนิ้มมือ แต่คือความสามารถในการตรวจอัตลักษณ์ ซึ่งไม่ว่าคนคนนั้นจะไปเปลี่ยนสัญชาติ มีพาสปอร์ตกี่เล่มมันก็จะตรวจได้หมด ซึ่งคุณภาพของระบบนี้ยังรวมไปถึงการตรวจเช็กของคนที่อยู่ในแบล๊กลิสต์ เพื่อป้องกันไม่ให้คนที่ติดแบล๊กลิสต์แต่มีการเปลี่ยนพาสปอร์ต-สัญชาติกลับมาได้
ถ้าท่านทั้งหลายไม่เชื่อผม ก็ลองไปดูที่ ตม. ชี้แจงโดยเฉพาะวรรคท้ายว่าปัจจุบันจะมีการซื้อระบบที่เรียกว่า TIS ในมูลค่า 3,200 ล้านบาท ซึ่งกว่าจะใช้ได้เต็มระบบคืออีก 29 เดือนถัดจากนี้ (ตม.ไม่ได้ชี้แจงส่วนนี้ แต่ปรากฏใน กมธ.) แล้วถ้าระบบที่ทำกันอยู่ว่ามีการเก็บไบโอเมตริกซ์กันเนี่ย มันดีอยู่แล้ว ดังนั้นจะไปตั้งงบ 3,200 ล้านบาทกันทำไม เพราะคนใน ตม.รู้ดีไงว่าระบบที่ใช้อยู่มันใช้ไม่ได้จริง เป็นระบบโบราณที่ไม่เท่าทันสถานการณ์ความคับขันในตอนนี้
แล้วผมอยากจะฟ้องพี่น้องประชาชนให้ดังไปถึงหูนายกรัฐมนตรีที่กำกับดูแลตำรวจว่า ตำรวจที่มาชี้แจงต่อ กมธ.ความมั่นคงแห่งรัฐเมื่อวาน ผมได้ยินจากนาตาชาใน ตร.ว่าเดิมเขากำลังจะถูกโยกย้ายไปในที่ดีๆ เนื่องจากตำรวจท่านนี้เป็นผู้มีความสามารถ ปรากฏว่าผู้บังคับบัญชาจะแกล้งเขา เพราะหาว่ามาพูดความจริงกับกรรมาธิการ จน ตม.ถูกตั้งคำถามจากสังคม โดยจะย้ายเขาไปในที่ที่แย่กว่าเดิม ทาง ผบ.ตร. บิ๊กต่าย ท่านช่วยปกป้องลูกน้องของท่านด้วย การกลั่นแกล้งแบบนี้ควรหยุดได้แล้ว
อ้อเกือบลืมไป ปัจจุบัน ตร.มี รอง ผบ.ตร. จำนวน 6 คน (นับ จตช. ด้วย) ผู้ช่วย ผบ.ตร. 13 คน รวม 19 คน พวกท่านทั้งหลายไม่มาชี้แจงต่อ กมธ. หลบอยู่หลังลูกน้อง พอลูกน้องพูดความจริง ก็จะทำโทษเขา น่าอายจริงๆ แบบนี้จะมีกันเยอะแยะไปทำไม",https://www.matichon.co.th/politics/news_5061257
เด็กภท. อัดยับ เอาฮั้วเลือกส.ว. เป็นคดีพิเศษ ส่อขัดรธน. ใช้อำนาจล้มล้างฝ่ายนิติบัญญัติ,วันที่ 22 กุมภาพันธ์ 2568 - 13:09 น.,"”คารม“ กังวล “ดีเอสไอ” นัดประชุมบอร์ดคดีพิเศษ 25 ก.พ.นี้ คดีฮั้วเลือกตั้ง สว. เข้าเป็นคดีพิเศษ ส่อขัดกม. เพราะเป็นอำนาจกกกต. อัด “รมว.ยธ.”ใช้อำนาจขัดรธน. หวังล้มล้างฝ่ายนิติบัญญัติ
เมื่อวันที่ 22 กุมภาพันธ์ นายคารม พลพรกลาง สมาชิกพรรคภูมิใจไทย ในฐานะนักกฎหมาย แสดงความเห็นทางกฎหมายกรณีที่มีกลุ่มผู้สมัคร ส.ว. ที่ไม่ได้รับเลือกไปยื่นหนังสือต่อกรมสอบสวนคดีพิเศษ โดยอ้างว่าการเลือก ส.ว.มีการฮั้วกัน และมีแนวโน้มว่าจะรับเป็นคดีพิเศษ เรื่องนี้ต้องรับว่าเป็นเรื่องใหญ่ และเป็นประเด็นทางกฎหมายที่น่าสนใจมาก เพราะกรมสอบสวนคดีพิเศษที่ถูกตั้งขึ้นในปี 2545 นั้น โดยมีเจตนาเพื่อเป็นพนักงานสอบสวนในคดีอาญา ในคดีอาชญากรรมที่มีผลกระทบเศรษฐกิจ มีการกระทำความผิดที่ซับซ้อน เป็นเครือข่ายอาชญากรรมเดิมนั้น เดิมผู้ที่ทำหน้าที่สอบสวนคดีอาญาทุกประเภท คือพนักงานสอบสวนของสำนักงานตำรวจแห่งชาติ
นายคารมกล่าวว่า จากพระราชบัญญัติ (พ.ร.บ.) การสอบสวนคดีพิเศษฯนั้น กำหนดให้กรมสอบสวนคดีพิเศษสังกัดกระทรวงยุติธรรม ซึ่งเป็นฝ่ายการเมือง มีรัฐมนตรีว่าการกระทรวงยุติธรรม เป็นผู้กำกับ เพราะฉะนั้น เมื่อพิจารณาเจตนารมณ์ในการจัดตั้งกรมสอบสวนคดีพิเศษนั้น จะเห็นว่าต้องการให้มีพนักงานสอนสวนในคดีอาญาที่มีความสลับซับซ้อนมากกว่าคดีอาญาทั่วไป แต่ไม่น่าจะรวมถึงคดีที่เกี่ยวข้องรัฐธรรมนูญ ที่ระบุไว้เฉพาะ และข้าราชการในกรมสอบสวนคดีพิเศษ เป็นเพียงพนักงานสอบสวน เหมือนพนักงานสอบสวนคดีอาญาทั่วไป การฟ้องคดีจึงต้องส่งผ่านพนักงานอัยการ เพื่อฟ้องคดี ตามประมวลกฎหมายวิธีพิจารณาความอาญาตามปกติของการฟ้องคดี
นายคารมกล่าวว่า ส่วนสมาชิกวุฒิสภา (ส.ว.) เป็นผู้ที่มาตามรัฐธรรมนูญแห่งราชอาณาจักร พ.ศ.2560 มาตรา 107 ถึง 113 การเลือกตั้ง หรือการสรรหาสมาชิกวุฒิสภาเป็นไปตามรัฐธรรมนูญ ซึ่งเป็นกฎหมายสูงสุด และตามพระราชบัญญัติประกอบรัฐธรรมนูญว่าด้วยการเลือกสมาชิกวุฒิสภา และคนรับรองสมาชิกวุฒิสภา คือกรรมการการเลือกตั้ง (กกต.)
นายคารมกล่าวว่า การที่กรมสอบสวนคดีพิเศษจะนัดประชุมคณะกรรมการสอบสวนคดีพิเศษ ในวันที่ 25 ก.พ.นี้ เพื่อพิจารณาว่าจะรับคดีที่มีผู้ที่ลงสมัครรับเลือกตั้งสมาชิกวุฒิสภา แต่ไม่ได้รับเลือกมาร้องและอ้างว่าการเลือกตั้งเป็นไปโดยไม่ชอบนั้น จึงมีคำถามทางกฎหมายว่า 1.แม้รัฐมนตรีว่าการกระทรวงยุติธรรมจะบอกว่าอาจรับเรื่องดังกล่าวไว้พิจารณาสามารถทำได้เพราะถือกฎหมายคนละฉบับ แต่เมื่อพิจารณาให้ลึกซึ้งและละเอียดแล้ว การพ้นตำแหน่งของสมาชิกวุฒิสภาภายหลังจากกรรมการการเลือกตั้งรับรองแล้ว ย่อมเป็นไปตามมาตรา 111 ของรัฐธรรมนูญ แม้กรมสอบสวนคดีพิเศษจะมีการดำเนินคดีก็อาจทำได้เฉพาะบุคคล แต่แม้จะดำเนินคดีอาญาเฉพาะบุคคล ในสมัยประชุม ก็ต้องขออำนาจจากสภา หากจะจับกุม คุมขังในสมัยการประชุมสภาก็ไม่อาจทำได้
2.คดีที่อ้างว่าการเลือกตั้ง ส.ว. ไม่ชอบด้วยกฎหมาย แต่คณะกรรมการการเลือกตั้ง ได้รับรองและยืนยันแล้ว ว่าไม่มีข้อเท็จจริงที่เป็นไปตามคำกล่าวหา หรือคำร้อง และ กกต.เป็นองค์กรที่จัดการเลือกตั้ง ได้รับรองแล้ว แต่หากกรมสอบสวนคดีพิเศษจะรับเป็นคดีพิเศษ และให้มีการดำเนินคดีอาญากับ ส.ว. จะถือว่าเป็นการจงใจใช้อำนาจที่ชอบด้วยกฎหมายไหม 3.การที่รัฐมนตรียุติธรรมอ้างว่า มีสมาชิกวุฒิสภาจำนวนถึง 138 คน และกรมสอบสวนคดีพิเศษดำเนินคดีจนต้องพ้นตำแหน่งทั้ง 138 คน ซึ่งเกินกึ่งหนึ่งของจำนวนสมาชิกวุฒิสภา ก็ต้องมีการเลือกวุฒิสภาขึ้นใหม่ เพื่อให้ครบ 200 คนถึงจะปฏิบัติหน้าที่ได้ ตามรัฐธรรมนูญมาตรา 107 ย่อมแปลได้ว่ากรมสอบสวนคดีพิเศษสามารถล้มการเลือกสมาชิกวุฒิสภาได้ ทั้งที่สมาชิกวุฒิสภามาตามรัฐธรรมนูญ
4.การที่รัฐมนตรีว่าการกระทรวงยุติธรรม ซึ่งเป็นฝ่ายบริหาร และเป็นผู้บังคับบัญชากรมสอบสวนคดีพิเศษ แต่ใช้อำนาจตามกฎหมาย ซึ่งเป็นเพียงพระราชบัญญัติ และมีศักดิ์ต่ำกว่ารัฐธรรมนูญมาดำเนินการ ซึ่งหากเป็นไปตามที่มีผู้สมัคร ส.ว.ที่ไม่รับการเลือกตั้งร้องมาก็อาจทำให้ ส.ว.ต้องหลุดไป หรือปฏิบัติหน้าที่ไม่ได้ ถึง 138 คนนั้น ถือเป็นการใช้อำนาจหน้าที่ขัดรัฐธรรมนูญได้ไหม และมีผลอย่างไร หรือเป็นเพียงการปฏิบัติหน้าที่โดยมิชอบตามประมวลกฎหมายอาญาทั่วไป
“ประเด็นเรื่องนี้ จึงเป็นประเด็นที่สำคัญทางกฎหมายอย่างยิ่ง สามารถนำเอาไปทำวิทยานิพนธ์ได้เลย เพราะเป็นการใช้อำนาจขององค์กรทางการบริหารมาล้มล้างฝ่ายนิติบัญญัติที่ดูสุ่มเสี่ยงว่าจะขัดต่อรัฐธรรมนูญ และอาจเป็นจุดจบของฝ่ายนิติบัญญัติ หากกรมสอบสวนคดีพิเศษสามารถทำได้ เพราะถ้าตรวจสอบสมาชิกวุฒิสภาจนต้องหลุดไป ทั้งที่ กกต.รับรองไปแล้ว ต่อไปก็จะมีการตรวจสอบสมาชิกสภาผู้แทนราษฎรได้ เช่น โดยมีการอ้างว่ามีการฮั้วการเลือกตั้ง อำนาจกรมสอบสวนคดีพิเศษก็จะใหญ่กว่าอำนาจของประชาชน ผมเชื่อว่า เจตนารมณ์ของกฎหมายตอนร่างขึ้นไม่น่าจะเป็นแบบนี้“ นายคารมกล่าว",https://www.matichon.co.th/politics/news_5061210
