title,date,content,link
เสรี ยันดีเอสไอ มีอำนาจสอบโพยฮั้ว บี้กกต.ทำหน้าที่ เชื่อปชช.เห็น ไม่งั้นจะเรียกก๊วนสีน้ำเงินหรือ?,วันที่ 22 กุมภาพันธ์ 2568 - 12:27 น.,"เชื่อผมเถอะ “อดีต ส.ว.เสรี” ชี้ ดีเอสไอ มีอำนาจสอบ ส.ว. เชื่อคนทั้งประเทศเห็นบล็อกโหวตได้คะแนนเป็นชุด แนะ กกต.ควรทำหน้าที่ของตัวเอง หากไม่ทำจะติดคุกเสียเอง
เมื่อวันที่ 22 กุมภาพันธ์ นายเสรี สุวรรณภานนท์ อดีต ส.ว. ได้โพสต์ข้อความผ่านเฟซบุ๊ก ระบุว่า การฮั้วการเลือกตั้ง ส.ว. เป็นอำนาจหน้าที่เฉพาะของคณะกรรมการการเลือกตั้ง (กกต.) หรือไม่ ก็คงต้องไปดูว่า การกระทำดังกล่าวเป็นความผิดต่อกฎหมายหลายบทหรือไม่ การกระทำเดียวกัน อาจเป็นความผิดต่อกฎหมายการได้มา ซึ่งสมาชิกวุฒิสภาได้ ในการกระทำเดียวกันที่ถูกกล่าวหาว่ามีการทุจริตเกี่ยวกับการได้มาซึ่งสมาชิกวุฒิสภา ในขณะเดียวกันอาจเป็นความผิดตามกฎหมายอาญาในข้อหาอั้งยี่ซ่องโจร ฟอกเงินหรือความฐานอื่นหากมีด้วย
นายเสรีระบุต่อว่า ดังนั้น กรมสอบสวนคดีพิเศษ (ดีเอสไอ) จึงมีอำนาจสอบสวนและดำเนินคดีกับผู้กระทำความผิดในข้อหาอั้งยี่ซ่องโจร ฟอกเงินหรือความผิดฐานอื่นที่กฎหมายบัญญัติว่าเป็นความผิดได้ เพราะเป็นการกระทำกรรมเดียวแต่เป็นความผิดต่อกฎหมายหลายบทดังกล่าว
การกระทำดังกล่าว หากพูดกันตามเนื้อผ้า ประชาชนทั้งประเทศก็เห็นเหมือนกัน สื่อมวลชนทั่วไปก็ทราบความดีว่ามีการกระทำที่ผิดกฎหมาย ทำให้เห็นว่ามีการบล็อกโหวตด้วยการลงคะแนนเป็นชุดๆ และมีพฤติการณ์อื่นที่มีความชัดเจน ที่ตนเคยเสนอความเห็นมาตั้งแต่แรกแล้วว่าเป็นพยานหลักฐานตั้งแต่แรก จนการได้มาถูกเรียกว่าเป็น ส.ว.กลุ่มสีน้ำเงิน
“ปัญหาใหญ่มันอยู่ที่ กกต.ไม่ทำหน้าที่ ซึ่งหลังจากที่ กกต.รับรองผลการเลือกไปแล้ว ก็มีหน้าที่ต้องตรวจสอบ และวินิจฉัยชี้ขาดปัญหาที่มีการร้องเรียน แต่ กกต.ไม่ทำให้เกิดความกระจ่าง เรื่องมันก็ยิ่งยุ่ง ทั้งที่เป็นเรื่องที่ กกต.ต้องรับผิดชอบ เวลายิ่งผ่านไปนานวันเท่าใด กกต.ก็จะมีความผิดชัดเจนและมัดตัว กกต.มากขึ้นไปเรื่อยๆ” นายเสรีระบุ
นายเสรีระบุอีกว่า ประการสำคัญ คือ กระบวนการเลือกตั้งที่เราพยายามหาบุคคลเข้ามาเป็นกรรมการเลือกตั้ง อันมีหน้าที่สำคัญที่ต้องให้ความเป็นธรรมและสร้างความถูกต้องในเลือกตั้ง ส.ส.และการได้มาซึ่ง ส.ว. แต่ กกต.กลับไม่ทำให้เป็นบรรทัดฐานที่ถูกต้องดีงาม มันเป็นเรื่องที่น่าเสียใจและน่าเสียดายที่กฎหมายเขียนไว้อย่างดี แต่ปัญหาอยู่ที่คนที่อยากเข้าเป็น กกต.แต่ไม่ทำหน้าที่
“จริงๆ แล้วก็ไม่รู้ว่าจะเข้ามาเป็นทำไม เชื่อผมเถอะ เห็นมาเยอะแล้ว การที่ กกต.หากมีหน้าที่แล้วไม่ทำ ไปๆ มาๆ ดูแล้ว กกต.จะเป็นคนที่ติดคุกเสียเอง กกต.ควรรีบทำอะไรๆ ในหน้าที่ของตนให้ถูกต้องเป็นธรรม ตามอำนาจหน้าที่ของตน” นายเสรีระบุ",https://www.matichon.co.th/politics/news_5061163
ประธานกกต. แจง ได้รับหนังสือดีเอสไอ คดีฮั้วเลือกส.ว.แล้ว แต่อยู่ระหว่างจัดทำความเห็นสนง. ก่อนส่งพิจารณา,วันที่ 22 กุมภาพันธ์ 2568 - 11:44 น.,"ประธาน กกต. แจง สนง.ได้รับหนังสือดีเอสไอ คดีฮั้วเลือก ส.ว.แล้ว อยู่ระหว่างประมวลเรื่องก่อนส่ง กกต. พิจารณา
เมื่อวันที่ 22 กุมภาพันธ์ นายอิทธิพร บุญประคอง ประธานกรรมการการเลือกตั้ง (กกต.) กล่าวถึงกรณีกรมสอบสวนคดีพิเศษ (ดีเอสไอ) มีหนังสือด่วน แจ้งความคืบหน้าผลการสืบสวน และขอความเห็นการดำเนินคดี กรณีมีผู้ร้องต่อดีเอสไอ เกี่ยวกับการฮั้วกันในการเลือก ส.ว. และดีเอสไอได้ทำการสืบสวนและรวบรวมพยานหลักฐาน เชื่อได้ว่ามีขบวนการดังกล่าวจริง และเข้าข่ายความผิดอาญาฐานอั้งยี่ และความผิดฐานฟอกเงิน กรมสอบสวนคดีพิเศษจึงประสงค์ที่จะรับดำเนินการสอบสวนในส่วนที่พบการกระทำผิดทางอาญาไว้ดำเนินการว่า ทราบว่าสำนักงาน กกต.ได้รับหนังสือฉบับนี้แล้ว และอยู่ระหว่างการประมวลเรื่องและจัดทำความเห็นของสำนักงานฯเพื่อเสนอที่ประชุม กกต. พิจารณาตามแนวทางปฏิบัติของสำนักงานที่ได้วางไว้ ส่วนที่ปรากฏหนังสือว่า สำนักงาน กกต.มีการตอบกลับไปที่ดีเอสไอว่า ยังไม่ได้เสนอเรื่องให้ กกต.นั้น เป็นเพราะยังอยู่ในกระบวนการพิจารณาของสำนักงาน กกต.
ผู้สื่อข่าวรายงานว่า นายแสวง บุญมี เลขาธิการ กกต. ได้มีหนังสือลงวันที่ 18 กุมภาพันธ์ 2568 ตอบกลับไปยังอธิบดีกรมสอบสวนคดีพิเศษ เรื่องแจ้งการรับเรื่องการกระทำความผิดกฎหมายเกี่ยวกับการเลือกตั้งและ พรรคการเมือง หลังจากที่ได้รับหนังสือจากกรมสอบสวนคดีพิเศษ ที่ระบุว่าได้รับเรื่องร้องเรียนเกี่ยวกับการเลือก ส.ว.ที่ไม่เป็นไปด้วยความสุจริตและเที่ยงธรรม จำนวน 3 เรื่อง ซึ่งในหนังสือตอบกลับของเลขาธิการ กกต.ระบุว่ายังไม่ได้นำเสนอเรื่องให้ กกต.พิจารณาตามมาตรา 49 แห่งพระราชบัญญัติประกอบรัฐธรรมนูญ (พ.ร.ป.) ว่าด้วย กกต. เนื่องจากเรื่องดังกล่าวไม่ปรากฏข้อเท็จจริงว่ากรมสอบสวนคดีพิเศษได้รับเรื่องไว้พิจารณาแล้วหรือไม่",https://www.matichon.co.th/politics/news_5061127
พิธา มอง 5 ปียุบอนาคตใหม่ “บริบทเปลี่ยน แต่การทำลายทางเลือกของปชช.ยังไม่เปลี่ยน”,วันที่ 22 กุมภาพันธ์ 2568 - 11:43 น.,"”พิธา“ มอง ประชาธิปไตย ไม่ได้ถูกยุบไปพร้อมกับพรรค หลังครบรอบ 5 ปี ยุบ”อนาคตใหม่“
ห่วงใช้จริยธรรมทางการเมืองมาเป็นอาวุธทำลายประชาธิปไตย
เมื่อวันนี้ 22 กุมภาพันธ์ 2568 นายพิธา ลิ้มเจริญรัตน์ อดีตหัวหน้าพรรคก้าวไกล โพสต์ข้อความผ่านเฟสบุ๊กแสดงความคิดเห็นถึงวาระ 5 ปี ยุบพรรคอนาคตใหม่ โดยกล่าวว่า ตนไม่รู้จะเรียกว่าตลกร้ายหรืออะไร ที่วันนี้ วันครบรอบ 5 ปีของการยุบพรรคอนาคตใหม่ และเป็นช่วงวันที่ ป.ป.ช. เรียกตัวตนเองและเพื่อน ส.ส อดีตพรรคก้าวไกล ไปในคดีจริยธรรมของ 44 ส.ส. ในวันที่ 2 วันนี้ พอดิบพอดี
“ในขณะที่สิ่งเหล่านั้นเกิดขึ้น ผมกลับมาทำงาน อยู่ที่ มหาวิทยาลัยฮาร์วาร์ด ขึ้น Panel เดียวกันอดีตอาจารย์ของผม Professor Archon Fung ผู้สอนผมเกี่ยวกับ ‘จริยธรรมและการเมือง’ ซึ่งเป็นหัวข้อที่สะท้อนถึงสถานการณ์ของผมในวันนี้อย่างน่าประหลาด”
นายพิธา กล่าวว่า ‘จริยธรรม’ ในการเมือง ควรเป็นหลักยึดเพื่อให้ผู้นำรับใช้ประชาชนมากกว่าผลประโยชน์ส่วนตัว เป็นกลไกที่ช่วยให้การเมืองสะอาดขึ้น และทำให้สังคมมีมาตรฐานที่สูงขึ้น แต่เมื่อ ‘จริยธรรม’ ถูกนำมาใช้เป็นเครื่องมือทางการเมือง—ไม่ได้สัดส่วนระหว่างความผิดกับโทษ ไม่มีสิทธิ์ในการอุทธรณ์ หรือถูกใช้แบบเลือกปฏิบัติ—มันไม่ได้ทำให้ระบบการเมืองดีขึ้น ตรงกันข้าม มันกลายเป็นอาวุธที่ใช้ทำลายฝ่ายตรงข้ามและบ่อนทำลายประชาธิปไตยเสียเอง
“5 ปีผ่านไป สิ่งที่เปลี่ยนคือบริบท สิ่งที่ไม่เปลี่ยนคือความพยายามทำลายทางเลือกของประชาชน แต่สิ่งหนึ่งที่ผมเชื่อมั่นเสมอ—พลังของประชาธิปไตยไม่ได้ถูกยุบไปพร้อมกับพรรค” นายพิธา กล่าว",https://www.matichon.co.th/politics/news_5061079
