title,date,content,link
ชัชชาติ ประกาศ “ผมจะเป็น ผู้ว่าฯ ของทุกคน”,22 พฤษภาคม 2022,"เมื่อเวลาประมาณ 20.30 น. ชัชชาติ สิทธิพันธุ์ ผู้สมัครหมายเลข 8 สังกัดอิสระ ประกาศพร้อมเป็นผู้ว่าฯ กทม. ที่ทำงานเพื่อคนกรุงเทพฯ ทุกกลุ่มอย่างเท่าเทียม พร้อมจับมือทำงานร่วมกับ ส.ก. ทุกพรรค ไม่มีการแบ่งแยกทั้งนี้ การนับคะแนนตลอด 3 ชั่วโมงกว่าหลังปิดหีบเลือกตั้ง ชัชชาติคือผู้ที่ได้คะแนนนำเป็นอันดับหนึ่งด้วยสัดส่วนคะแนนเกินร้อยละ 51 มาโดยตลอด หลายคนคาดการณ์ว่า เก้าอี้ผู้ว่าฯ กทม. ย่อมเป็นของชัชชาติอย่างแน่นอนและสามารถติดตามผลคะแนนผู้ว่าฯ กทม.-ส.ก. แบบจัดเต็มได้อีกหนึ่งช่องทางผ่านหน้าเกาะติดผลการนับคะแนนเลือกตั้งผู้ว่าฯ-ส.ก. บนเว็บไซต์https://bkkelection2022.wevis.info/โดย THE STANDARD x WeVis x Wisesight“ผมจะเป็นผู้ว่าฯ ของทุกคน ท่านไหนจะเลือกหรือไม่เลือกผม ผมก็ต้องรับใช้ทุกคนเหมือนกัน เพราะผมถือว่าเราได้เป็นตัวแทนของคนกรุงเทพฯ”“อนาคตต่อไปเรามาเดินร่วมกัน เราเห็นต่างกันได้ แต่เราอย่าเกลียดกัน เราอย่าทะเลาะกัน ถ้าเกิดคนไหนได้สิทธิมาดูแลพี่น้องประชาชน ก็ต้องดูแลทุกคนอย่างเท่าเทียม”“กรุงเทพฯ เป็นมหานครที่เต็มไปด้วยความหวัง มันสวยงาม มีสิ่งที่มีคุณค่ามากมาย แต่ที่ผ่านมาจะมีหลายเหตุการณ์ที่ทำให้เพชรเม็ดนี้ไม่ได้รับการเจียระไนเต็มที่ ผมขออาสาเป็นผู้นำแห่งความหวังให้พวกเราทุกคน”“ผมต้องขอขอบคุณผู้สมัครทุกท่านที่กรุณาเดินทางร่วมกันมา ผมคิดถึงทุกท่านนะ เพราะว่าเราดีเบตกันหลายครั้ง เมื่อกี้คุณวิโรจน์, ดร.เอ้ เดินมา ยังคิดถึงว่า เฮ้ย เดี๋ยวไปกินข้าวกันหน่อยเว้ย”“นโยบายของผู้สมัครทุกท่านมีข้อดีที่เราจะน้อมรับมาแล้ว ก็เอามาเป็นนโยบายที่ปรับปรุงได้ ของเราไม่ได้ดีครบถ้วนหรอกครับ แต่เราถือโอกาสนี้เอานโยบายของทุกท่านมารวมกัน แล้วเราจะทำงานร่วมกับ ส.ก. ทุกท่านด้วย ผมว่านี่คือสิ่งสำคัญนะครับที่เราเดินไปด้วยกัน”“กรุงเทพฯ ประเทศไทย ต้องการการเปลี่ยนแปลงให้ดีขึ้น ผมเชื่อว่ามูฟเมนต์ของเราอาจจะจุดประกายได้ แต่มันจะอยู่แค่ไหนก็ไม่แน่ ต้องรอดูกันต่อไป”สามารถติดตามผลคะแนนผู้ว่าฯ กทม.-ส.ก. แบบจัดเต็มได้อีกหนึ่งช่องทางผ่านหน้าเกาะติดผลการนับคะแนนเลือกตั้งผู้ว่าฯ-ส.ก. บนเว็บไซต์https://bkkelection2022.wevis.info/โดย THE STANDARD x WeVis x Wisesight",https://thestandard.co/bkk-election-22052022-chadchart-sittipunt/
ชาวชุมชนคลองเตยฉลองวันเกิดล่วงหน้าให้ชัชชาติระหว่างลงพื้นที่ เจ้าตัวสัญญาจะเป็นผู้ว่าฯ ติดดิน ทำชีวิตทุกคนให้ดีขึ้น,23 พฤษภาคม 2022,วันนี้ (23 พฤษภาคม) เวลา 17.20 น. ชัชชาติ สิทธิพันธ์ุ ผู้สมัครผู้ว่าราชการกรุงเทพมหานคร (ผู้ว่าฯ กทม.) ลงพื้นที่ชุมชนคลองเตย พบประชาชนชุมชน 70 ไร่ และมูลนิธิดวงประทีป เพื่อขอบคุณชาวคลองเตย ซึ่งตลอดเส้นทางมีประชาชนมาแสดงความยินดีและมอบดอกไม้ โดยชัชชาติระบุว่า ขอให้สัญญากับชาวคลองเตยว่าจะเป็นผู้ว่าฯ ที่ติดดิน ลงมาหาเหมือนเดิม ไม่เปลี่ยนแปลง และจะทำให้ชีวิตดีขึ้นทั้งนี้ ชัชชาติกล่าวถึงเหตุผลที่เลือกมาชุมชนคลองเตยเป็นที่แรกว่า เนื่องจาก 2 ปีครึ่งที่แล้ว ได้มาเปิดตัวลงชิงผู้ว่าฯ กทม. ที่นี่ บริเวณตรอกโรงหมู ตอนนี้โดนรื้อหมดแล้ว เป็นเรื่องน่าเศร้ามากว่าเด็กที่นี่จะไปทำกิจกรรมที่ไหนชัชชาติระบุว่า ชาวชุมชนคลองเตยมีทั้งหมด 28 ชุมชน มีคนอยู่จำนวนมาก ปัจจัยสำคัญที่คลองเตยมีคือชุมชนเข้มแข็ง สามารถช่วยตัวเองและเอาตัวรอดได้ผ่านวิกฤตโควิด ซึ่งเป็นกำลังสำคัญในการพัฒนาเมือง ถ้าชุมชนเข้มแข็ง ก็สามารถใช้เป็นแนวทางพัฒนากรุงเทพฯ ในอนาคตได้เมื่อมีโอกาสได้กลับมาพื้นที่อีกครั้งในฐานะว่าที่ผู้ว่าฯ กทม. รู้สึกว่ามีความผูกพันระหว่างตนเองและชาวคลองเตย จากนี้มีพันธกิจที่ต้องรับผิดชอบตามที่ประชาชนสั่งให้ทำ ซึ่งไม่หนักใจและจะทำให้ดีที่สุด และไม่ใช่แค่คลองเตย แต่ทั้งกรุงเทพฯ ดังนั้นต่อไปไปเขตไหนจะแจ้งว่าที่สมาชิกสภากรุงเทพมหานคร (ส.ก.) ให้มาร่วมมือกัน จะประสานงานให้ได้กับทุกคนอย่างไรก็ตาม สิ่งแรกที่จะทำให้กับชาวคลองเตยคือเรื่องของการศึกษา เพราะการศึกษาเป็นเครื่องมือในการลดความเหลื่อมล้ำ ช่วยให้หลุดพ้นจากความยากจนได้ พร้อมทั้งจะส่งเสริมห้องสมุด เพื่อสร้างให้เด็กมีความรู้ กทม. ต้องเตรียมเรื่องพวกนี้ไว้เป็นเครื่องมือสร้างโอกาส งบประมาณใช้แค่หลักล้านบาท และปัจจุบันมีโครงสร้างพื้นฐานหลักอยู่แล้ว ซึ่งไม่ได้ใช้เงินเยอะเมื่อเทียบกับอุโมงค์ระบายน้ำ 2 หมื่นล้านส่วนกรณีที่มีคนยื่นหนังสือตรวจสอบนโยบาย 213 นโยบาย ว่าจะทำได้จริงหรือไม่นั้น ชัชชาติมองว่าเป็นเรื่องดีและต้องพร้อมกับการตรวจสอบ เพราะที่ผ่านมาปัญหาของการเมืองก็มีปัญหาที่สัญญาไว้กับประชาชนแล้วทำไม่ได้ ทั้งการขึ้นค่าแรง การประกันราคา ตนเองยินดีให้ตรวจสอบ เพราะมีที่มาที่ไปในการคิด ไม่ใช่กระดาษเปล่าๆ และขอบคุณท่านที่ให้ความสำคัญกับนโยบายและที่ยื่นตรวจสอบ แต่ก็ขอให้อ่านให้ละเอียดด้วย จะได้รู้ที่มาที่ไปเป็นอย่างไร ตรงไหนต้องปรับปรุงให้ดีขึ้นขณะที่ชัชชาติลงพื้นที่ พบชาวชุมชนคลองเตยหลายคนได้ร่วมกันร้องเพลงอวยพรวันคล้ายวันเกิดล่วงหน้า พร้อมกับเป่าเค้กให้กับชัชชาติ ซึ่งจะอายุครบ 56 ปีในวันพรุ่งนี้ (24 พฤษภาคม) พร้อมขอให้ชัชชาติเป็นผู้ว่าฯ กทม. ที่จะทำให้ประชาชนมีชีวิตดี อยู่ดี กินดี มีการศึกษาที่ดี และผู้สูงวัยได้รับการดูแล,https://thestandard.co/khlong-toei-happy-birthday-chadchart/
สุชาติ แกนนำพลังประชารัฐ ยินดี ชัชชาติ นั่งผู้ว่าฯ กทม. ขอทำตามสัญญาที่หาเสียงไว้ ทำไม่ได้ประชาชนจะลงโทษ,24 พฤษภาคม 2022,วันนี้ (24 พฤษภาคม) ที่ทำเนียบรัฐบาล สุชาติ ชมกลิ่น รัฐมนตรีว่าการกระทรวงแรงงาน ในฐานะผู้อำนวยการพรรคพลังประชารัฐ (พปชร.) กล่าวถึงผลการเลือกตั้งสนามผู้ว่าราชการกรุงเทพมหานคร (ผู้ว่าฯ กทม.) ว่า ต้องยอมรับว่าส่วนหนึ่งที่ ชัชชาติ สิทธิพันธุ์ ได้รับการเลือกตั้งเป็นผู้ว่าฯ กทม. เพราะได้แสดงเจตจำนงมานาน ทำการบ้านมานาน ซึ่งต้องยินด้วย และหากส่งสมาชิกสภากรุงเทพมหานคร (ส.ก.) ทั้ง 50 เขต ก็คงได้ทั้งหมดในส่วนของ ส.ก. พรรคพลังประชารัฐ ต้องยอมรับว่าโดยกฎหมายเลือกตั้ง ส.ส. และรัฐมนตรีของพรรคไม่สามารถลงไปช่วยหาเสียงได้แม้ผู้สมัครสังกัดพรรคจริง จึงต้องอาศัยความสามารถของผู้สมัคร ซึ่งการเลือกตั้งใหญ่คนละพื้นที่กัน แต่การเลือกตั้ง กทม. ถ้ามีการเลือกตั้ง ส.ส. ก็จะมี 33 เขต ถือเป็น 10% ของ 200 เขต จึงจะมาวัดกันไม่ได้เมื่อผู้สื่อข่าวถามว่าหลังจากนี้พรรคพลังประชารัฐต้องปรับกลยุทธ์อย่างไรบ้าง สุชาติกล่าวว่า จริงๆ ต้องยอมรับว่าการเลือกตั้งท้องถิ่นเป็นความอึดอัดของ ส.ส. กับรัฐมนตรี เพราะเขาใช้พรรคพลังประชารัฐในการลงสมัคร แต่เรากลับลงไปทำอะไรกับเขาไม่ได้ ลงไปช่วยหาเสียงไม่ได้ ต้องปล่อยให้เขาเดินของเขา และต้องยอมรับว่าพรรคการเมืองที่ส่ง ส.ก. ก็ไม่มีใครได้เกิน 50% เพราะคะแนนของชัชชาติกระโดดไปคนเดียว ถ้าส่ง ส.ก. 50 เขต ก็คงได้ครบ 50 เขต รับรองคนอื่นไม่มีได้แน่นอน เพราะคะแนนที่ออกมาชาวบ้านเลือกผู้ว่าฯ และอาจเลือก ส.ก. ที่คิดว่าน่าจะทำงานกับผู้ว่าฯ ได้ มองว่าเป็นทีมเดียวกัน ชาวบ้านคิดแบบนั้น เราไม่ได้ไปว่าพรรคใดพรรคหนึ่ง ต้องยอมรับว่าบริบทการเมืองท้องถิ่นต่างกัน ดังนั้นอยู่ที่พื้นที่และบริบท อย่าไปคิดว่าเป็นแลนด์สไลด์อะไรใหญ่โต แต่เลือกตั้งครั้งหน้าถึงจะได้รู้ว่าใครเป็นใครเมื่อผู้สื่อข่าวถามถึงกรณีที่ชัชชาติอ้างถึงคะแนนนิยมว่ามากกว่านายกรัฐมนตรี จะต้องมีการปรับอะไรหรือไม่ สุชาติกล่าวว่า เมื่อผลออกมาแล้วเขาก็พูดได้ ลองชัชชาติไปลงจังหวัดอื่นก็คงไม่ได้แบบนี้ ต้องยอมรับว่าเขาอยู่ในพื้นที่กรุงเทพฯ และมีภาพลักษณ์ที่คนกรุงเทพฯ อยากพึ่งพาและพึ่งพิงในสิ่งที่หาเสียงไว้ และถ้าทำในสิ่งที่หาเสียงไว้ได้ก็จะเป็นผู้ว่าฯ มีประสิทธิภาพจะเป็นผลลัพธ์ ถ้าครั้งนี้ทำได้ ครั้งหน้าอาจได้คะแนน 2 ล้านก็ได้ แต่หากทำไม่ได้คะแนนอาจเหลือ 2 แสนก็ได้ ดังนั้นอยู่ที่ว่าจะทำได้อย่างที่พูดหรือไม่เมื่อผู้สื่อข่าวถามว่าครั้งนี้จะมีผลกระทบต่อการเลือกตั้งใหญ่หรือไม่ เพราะ กทม. ถือเป็นฐานของพรรค สุชาติกล่าวว่า มี แต่องค์ประกอบไม่เหมือนกัน มีองค์ประกอบอื่นบางส่วนมาเกี่ยวข้อง ดังนั้นอยู่ที่ประชาชนตัดสินใจว่าประเทศชาติจะเดินทางไหน ตนยังเชื่อมั่นว่าพรรคพลังประชารัฐ ซึ่งสนับสนุน พล.อ. ประยุทธ์ จันทร์โอชา เป็นนายกรัฐมนตรีนั้น ภาพลักษณ์ พล.อ. ประยุทธ์ ยังดีกว่าหลายๆ คน ในความซื่อสัตย์สุจริตและการทำงานไม่ได้มีอะไรด่างพร้อย อาจถูกใจบ้างไม่ถูกใจบ้างก็ต้องยอมรับสถานการณ์ ถามว่าใครเคยมาเจอปัญหาโควิดแบบนายกฯ บ้าง“ใครเป็นนายกฯ ในสถานการณ์โควิดยากเย็นแสนเข็ญ ทั้งวิกฤตซ้อนวิกฤต เพราะต้องเจอสงครามรัสเซีย-ยูเครนอีก จึงขอย้อนถามกลับตั้งแต่นายกฯ ที่เป็นกันมา มีใครเคยเจอ 2-3 เหตุการณ์พร้อมๆ กันบ้าง ไม่มี เราจึงต้องมองภาพอย่างเป็นกลางด้วย มองว่าการเลือกตั้งผู้ว่าฯ กทม. ไม่ใช่แลนด์สไลด์อะไรทั้งสิ้น ถ้าเขามาลงบ้านผมแล้วชนะ แบบนี้สิน่าคิด ก็ขอยินดีกับทุกคนที่ได้ ขอให้ทำงานเพื่อประเทศชาติบ้านเมือง เพื่อประชาชนชาว กทม. เลือกแล้วก็ทำตามที่หาเสียงไว้ เพราะคนเราคำพูดเป็นนาย หาเสียงอะไรไว้ต้องทำให้ได้ ทำไม่ได้เลือกตั้งครั้งหน้าประชาชนก็ลงโทษ ถ้าทำได้แบบที่พูดคะแนนก็อาจทวีคูณ มันต้องดูกันยาวๆ แต่การเลือกตั้ง ส.ส. ที่จะเกิดขึ้นในระยะเวลาอีก 1 ปี เราต้องทำการบ้านเป็นปกติ เอามาวิเคราะห์ และยังเชื่อมั่นศักยภาพของ ส.ส. กทม. แต่ก็ต้องไม่ประมาท เพราะต้องยอมรับว่าทุกวันนี้ทุกอย่างประมาทไม่ได้” สุชาติกล่าว,https://thestandard.co/suchat-congratulate-chadchart/
