title,date,content,link
3 นักเตะเรอัล มาดริด ถูกจับข้อหาล่วงละเมิดทางเพศ-ถ่ายวิดีโอเด็กสาวอายุ 16 ปี,15/09/2566,สเปน 15 ก.ย. – นักเตะทีมเรอัล มาดริด 3 คน ถูกตำรวจจับกุมตัว ข้อหาล่วงละเมิดทางเพศและถ่ายวิดีโอเด็กสาวอายุไม่ถึง 16 ปี ขณะที่เรอัล มาดริด ออกมายืนยันผู้ถูกกล่าวหาทั้ง 3 คน ไม่ได้เป็นนักเตะชุดใหญ่สื่อสเปน รายงานว่า นักเตะ “ทีมราชันชุดขาว” เรอัล มาดริด 3 คน ถูกตำรวจจับกุมตัว ข้อหาล่วงละเมิดทางเพศและถ่ายวิดีโอเด็กสาว เมื่อวันที่ 14 กันยายนที่ผ่านมา หลังจากแม่ของเด็กสาวที่อายุยังไม่ถึง 16 ปี แจ้งความที่เมืองลาส พัลมาส ว่ามีการถ่ายคลิปวิดีโอโป๊เปลือยลูกสาวโดยไม่ได้รับอนุญาต หลังจากรู้ตัวว่าถูกถ่ายคลิปนี้ก็ถูกส่งต่อไปแล้วเหตุการณ์นี้เกิดขึ้นที่เมืองโมแกน ในช่วงกลางเดือนมิถุนายนที่ผ่านมา ขณะที่เรอัล มาดริด ออกมายืนยันว่าผู้ถูกกล่าวหาทั้ง 3 คน ไม่ได้เป็นนักเตะชุดใหญ่ของทีม เนื่องจากเวลานั้นโทรศัพท์มือถือของนักเตะถูกเก็บเอาไว้โดยสโมสร ทำให้ไม่สามารถใช้ได้ ส่วนผู้ที่ต้องสงสัยเป็นนักเตะของทีมคาสติยา ทีมสำรอง 1 คน และนักเตะทีมชุดซี 2 คน.-สำนักข่าวไทยFacebookFacebookXTwitterLINELineดูข่าวเพิ่มเติมNujareeนักเตะล่วงละเมิดทางเพศเรอัล มาดริดข่าวที่เกี่ยวข้องก่อนเกม ยูฟ่า แชมเปียนส์ลีก เรอัล มาดริด-แอต มาดริดเรอัล มาดริด บุกชนะ แมนฯ ซิตี้ 3-2 ยูฟ่า แชมเปี้ยนส์ ลีกเรอัล มาดริด บุกเยือน แมนฯ ซิตี ศึกยูฟ่า แชมป์เปียนลีก คืนนี้แมนฯ ซิตี้ ดวล มาดริด เพลย์ออฟแชมเปียนส์ ลีก‘เรอัล มาดริด’ ทำรายได้ในปีเดียวทะลุ 1 พันล้านยูโร,https://tna.mcot.net/sport-1238693
กกท. ยัน ราชมังคลากีฬาสถาน พร้อมเป็นสังเวียนแข้งคัดบอลโลก 2026,14/09/2566,ดร.ก้องศักด ยอดมณี ผู้ว่าการการกีฬาแห่งประเทศไทย ยืนยัน สนามราชมังคลากีฬาสถาน พร้อมเป็นสังเวียนแข้งของทีมฟุตบอลทีมชาติไทย ในแมตซ์เหย้าของ การแข่งขันศึกฟุตบอลโลก 2026 รอบคัดเลือก โซนเอเชีย หลังก่อนหน้านี้มีกระแสโจมตีเรื่องการใช้สนามราชมังคลากีฬาสถานในการใช้จัดกิจกรรมอื่นเช่น การแสดงคอนเสิร์ต เรื่องนี้ ผู้ว่า กกท.ได้ย้ำว่าได้มีการพูดคุยกับ สมาคมกีฬาฟุตบอลแห่งประเทศไทยฯ อยู่แล้วเรื่องแผนการใช้สนามในช่วงเวลาต่าง ๆ และ การใช้สนามนั้นกิจกรรมกีฬาต้องมาก่อนกิจกรรมอื่น ๆ โดยเฉพาะฟุตบอลนั้นต้องมาเป็นอันดับแรกก็ขอให้แฟนบอลไทยสบายใจได้ กกท.พร้อมจะสนับสนุนอย่างเต็มที่ในเรื่องนี้ด้านนายยุธยา จีนหีต ผู้อำนวยการฝ่ายธุรกิจกีฬา ในฐานะฝ่ายที่ได้รับมอบหมายสนามกีฬาราชมังคลากีฬาสถานโดยตรงก็ได้เปิดเผยว่า เรื่องสภาพสนามและการดูแลสนามนั้นเราก็ได้ปฎิบัติให้ได้ตามมาตรฐานมีการสำรวจพื้นที่ในสนามราชมังคลา เพื่อวัดระดับความสูงต่ำของสนามถ้าต่ำก็จะมีการท๊อปทรายให้พื้นมีระดับเสมอและเท่ากันทั่วทั้งสนามเพื่อช่วยระบายน้ำออกสู่ด้านข้างสนามให้เร็วยิ่งขึ้นเพราะช่วงนี้เป็นหน้าฝน ส่วนเรื่องหญ้าก็มีการดูแลรักษาเป็นอย่างดี มีการปรับปรุงให้มีมาตรฐานและมีความพร้อมอยู่เสมอในการรองรับการใช้งานทั้งการแข่งขันฟุตบอลและกีฬาอื่นๆ ตามนโยบายของผู้ว่าการ กกท.สำหรับโปรแกรมฟุตบอลโลก 2026 รอบคัดเลือก โซนเอเชีย รอบสอง ของทีมชาติไทย มีดังนี้16 พฤศจิกายน 2566 ทีมชาติไทย พบ จีน ที่สนามราชมังคลากีฬาสถาน21 พฤศจิกายน 2566 สิงคโปร์ หรือ กวม พบ ทีมชาติไทย21 มีนาคม 2567 เกาหลีใต้ พบ ทีมชาติไทย26 มีนาคม 2567 ทีมชาติไทย พบ เกาหลีใต้6 มิถุนายน 2567 จีน พบ ทีมชาติไทย11 มิถุนายน 2567 ทีมชาติไทย พบ สิงคโปร์ หรือ กวมFacebookFacebookXTwitterLINELineดูข่าวเพิ่มเติมratchanipong vorasarinการกีฬาแห่งประเทศไทยช้างศึกฟุตบอลฟุตบอลไทยข่าวที่เกี่ยวข้องBEM จับมือ กทพ. คิกออฟโครงการ “ฟุตบอลปันสุข สนุกรอบสายทาง” สร้างแรงบันดาลใจให้เยาวชนกลุ่มธุรกิจ TCP ปลุกพลังเยาวชน ส่งต่อโอกาสทางกีฬา มอบลูกฟุตบอลทั่วไทย“กกท.”ยกมาตรฐานกีฬาเยาวชนแห่งชาติสู่สากลมากขึ้น “ชลบุรี”นำร่องช้างศึก U-20 แพ้เกาหลีใต้ ตกรอบคัดเอเชีย“จเด็จ”ขอบคุณ”มาดามแป้ง”ดึงลูกครึ่งเข้าแคมป์กาตาร์ ลุยยู 17 อช. นักเตะยช.แมน ยู มาด้วย,https://tna.mcot.net/sport-1238458
“แวร์รัตติ” ตรวจร่างกาย ย้ายซบ “อัล อราบี” ศึกกาตาร์ สตาร์ ลีก,13/09/2566,"กาตาร์ 13 ก.ย. – มาร์โก แวร์รัตติ กองกลางทีมชาติอิตาลี วัย 30 ปี ตรวจร่างกาย ก่อนย้ายร่วมทีมอัล อราบี ศึกกาตาร์ สตาร์ ลีก ด้วยค่าตัว 45 ล้านยูโรมาร์โก แวร์รัตติ กองกลางทีมชาติอิตาลี วัย 30 ปี เดินทางถึงกรุงโดฮา ประเทศกาตาร์ เพื่อตรวจร่างกาย ก่อนย้ายร่วมทีมอัล อราบี ในศึกกาตาร์ สตาร์ ลีก หลังตัดสินใจย้ายจากปารีส แซงต์ แชร์กแมง ในศึกลีกเอิง ฝรั่งเศส มาร่วมทีม ด้วยค่าตัว 45 ล้านยูโร หรือประมาณ 1,710 ล้านบาทหลังจากก่อนหน้านี้ แวร์รัตติมีข่าวจะย้ายไปร่วมทีมอัล ฮิลาล และอัล อาลีห์ ในศึกซาอุดี โปรลีก แต่ตลาดซื้อขายนักเตะปิดลงก่อนจะย้ายทีมได้สำเร็จ สำหรับแวร์รัตติย้ายไปร่วมทีมเปแอสเช เมื่อปี 2012 และมีส่วนช่วยทีมคว้าแชมป์ลีกถึง 9 สมัย แต่กลับไม่อยู่ในแผนการทำทีมของ หลุยส์ เอ็นริเก กุนซือคนปัจจุบัน .-สำนักข่าวไทยFacebookFacebookXTwitterLINELineดูข่าวเพิ่มเติมNujareeกาตาร์ สตาร์ ลีกมาร์โก แวร์รัตติอัล อราบีข่าวที่เกี่ยวข้องมาร์โก แวร์รัตติ ย้ายซบ ลีกกาตาร์",https://tna.mcot.net/sport-1237505
ทีมชาติไทยเตะบอลโลก รอบคัดเลือก ที่ราชมังคลากีฬาสถาน,12/09/2566,กรุงเทพฯ 12 ก.ย. – “ช้างศึก” ทีมชาติไทย เตรียมลงทำศึกฟุตบอลโลก 2026 รอบคัดเลือก โซนเอเชีย นัดแรก พบจีน วันที่ 16 พ.ย.นี้ความเคลื่อนไหวของทีม “ช้างศึก” ทีมชาติไทย ก่อนลุยศึกฟุตบอลโลก 2026 รอบคัดเลือก โซนเอเชีย ที่อยู่ร่วมกลุ่มกับทีมชาติเกาหลีใต้ ทีมชาติจีน และผู้ชนะระหว่างสิงคโปร์ หรือกวม ล่าสุดมีการยืนยันอย่างเป็นทางการว่าจะใช้ราชมังคลากีฬาสถาน เป็นสนามเหย้าในการลงเล่นนัดแรก ถือเป็นการกลับมาลงเตะที่ราชมังคลากีฬาสถานเป็นครั้งแรก นับตั้งแต่ฟุตบอลเอเอฟเอฟ ซูซูกิ คัพ 2018 รอบรองชนะเลิศ นัดที่ 2 ซึ่งทีมชาติไทย เสมอ มาเลเซีย 2-2สำหรับโปรแกรมฟุตบอลโลก 2026 รอบคัดเลือก โซนเอเชีย นัดแรก ทีมชาติไทยจะพบทีมชาติจีน ในวันที่ 16 พฤศจิกายนนี้.-สำนักข่าวไทยFacebookFacebookXTwitterLINELineดูข่าวเพิ่มเติมNujareeช้างศึกทีมชาติไทยฟุตบอลโลก 2026ข่าวที่เกี่ยวข้องฟุตบอลหญิงไทย U-20 ถล่ม หมู่เกาะโซโลมอน 8-0ช้างศึก U-20 แพ้เกาหลีใต้ ตกรอบคัดเอเชียช้างศึก U-20 พร้อมดวล เกาหลีใต้ ชิงแชมป์เอเชียทัพวินด์เซิร์ฟไทยประกาศกวาดเรียบ 4 ทอง ศึกซีเกมส์ ครั้งที่ 33 ที่ไทยเป็นเจ้าภาพจับสลากแบ่งกลุ่มฟุตซอลหญิงชิงแชมป์เอเชีย 2025,https://tna.mcot.net/sport-1236967
เยอรมนีปลด “ฮันซี ฟลิค” พ้นหัวหน้าโค้ช หลังแพ้ญี่ปุ่น,11/09/2566,เยอรมนี 11 ก.ย.-สหพันธ์ฟุตบอลเยอรมนี ปลด “ฮันซี ฟลิค” พ้นจากตำแหน่งหัวหน้าโค้ชทีมอินทรีเหล็กเรียบร้อย หลังพาทีมแพ้ญี่ปุ่น 1-4 ส่วนเนเธอร์แลนด์ เฉือนชนะไอร์แลนด์ 2-1 ในฟุตบอลยูโร รอบคัดเลือกสหพันธ์ฟุตบอลเยอรมนี หรือ เดเอฟเบ ประกาศปลด ฮันซี ฟลิค เทรนเนอร์ทีมชาติเยอรมนีพ้นจากตำแหน่งอย่างเป็นทางการแล้ว หลังพาทีมแพ้ญี่ปุ่นคาบ้าน 1-4 ในเกมนัดอุ่นเครื่องเมื่อวันเสาร์ที่ผ่านมาโดยกุนซือวัย 58 ปี พาทีมอินทรีเหล็กผลงานย่ำแย่ในระยะหลังไม่ชนะใครมา 5 เกมแล้ว โดยก่อนหน้านี้ในรายการฟุตบอลโลก 2022 ก็พาทีมตกรอบแรก เดเอฟเบได้มอบหมายให้ รูดี โฟลเลอร์ ตำนานดาวยิงทีมชาติเยอรมนีามารับหน้าที่คุมทีมชั่วคราวไปก่อนส่วน หลุยส์ รูเบียเลส ประธานสหพันธ์ฟุตบอลสเปนได้ตัดสินใจลาออกจากตำแหน่งเรียบร้อย หลังก่อเหตุฉาวจูบปาก เจนี เอร์โมโซ นักเตะหญิงทีมชาติสเปน ระหว่างพิธีรับแชมป์ฟุตบอลหญิงชิงแชมป์โลก 2023 เมื่อเดือนสิงหาคม จนถูกสหพันธ์ฟุตบอลนานาชาติ ลงโทษแบน โดยรูเบียเลสให้เหตุผลว่า ตัวเองไม่สามารถทำงานต่อไปได้ พร้อมเผยด้วยว่า สมควรแล้วหรือที่ตนถูกไล่ล่าแบบนี้ด้านความคืบหน้ากรณีของ อันโตนี่ ปีกทีมชาติบราซิลของแมนเชสเตอร์ ยูไนเต็ด ที่กำลังมีคดีทำร้ายร่างกายอดีตแฟนสาว จนถูกตัดชื่อออกจากทีมชาติ ล่าสุด เจ้าตัวขอเลื่อนกลับไปยังสโมสรต้นสังกัด เพื่อจัดการปัญหาที่เกิดขึ้นก่อน เพื่อไม่ให้สโมสรต้องเกี่ยวข้องกับเรื่องนี้ อย่างไรก็ตามปีศาจแดงจะยังจ่ายเงินค่าเหนื่อยให้ตามปกติฟุตบอลยูโร 2024 รอบคัดเลือก กลุ่มบี ที่ประเทศไอร์แลนด์ เมื่อคืนนี้ คู่ที่น่าสนใจ ไอร์แลนด์ เปิดบ้านแพ้ เนเธอร์แลนด์ 1-2 เกมนี้ เวาท์ เวกฮอร์สต์ ยิงประตูชัยให้อัศวินสีส้มนาทีที่ 56 เนเธอร์แลนด์เตะ 4 นัดมี 9 คะแนนอยู่อันดับ 2 ตามหลังฝรั่งเศสที่เตะมากกว่า 1 นัด อยู่ 6 คะแนน .-สำนักข่าวไทยFacebookFacebookXTwitterLINELineดูข่าวเพิ่มเติมMissKTญี่ปุ่นสหพันธ์ฟุตบอลเยอรมนีหัวหน้าโค้ชฮันซี ฟลิคข่าวที่เกี่ยวข้องไฟป่าครั้งเลวร้ายที่สุดในญี่ปุ่นในรอบหลายสิบปียังไม่สงบญี่ปุ่นเตรียมดำเนินคดีสมาชิกแก๊งสแกมเมอร์ญี่ปุ่นเผชิญไฟป่าใหญ่ในรอบ 3 ทศวรรษไฟป่าในญี่ปุ่นเผาทำลายบ้านเรือน-ประชาชนหลายพันต้องอพยพไฟป่าเผาทำลายพื้นที่ในเมืองเมืองโอฟุนะโตะของญี่ปุ่น,https://tna.mcot.net/sport-1236276
